{
  "version": "2.0.0",
  "metadata": {
    "project": "PMP-GYWD",
    "extracted_at": "2026-01-10T12:00:00Z",
    "extraction_depth": "standard",
    "commit_range": {
      "from": "aad18745",
      "to": "18926c15",
      "count": 14
    }
  },
  "decisions": [
    {
      "id": "DEC-001",
      "type": "architectural",
      "summary": "Fork and rebrand get-shit-done as PMP-GYWD",
      "rationale": "Create an independent, professionally-named version while preserving the core context engineering approach",
      "alternatives_considered": [
        {
          "option": "Build from scratch",
          "reason_rejected": "Would lose proven patterns and take significantly longer"
        },
        {
          "option": "Contribute to original",
          "reason_rejected": "Wanted independent control over direction and branding"
        }
      ],
      "trade_offs": {
        "gained": ["Full ownership", "Professional naming", "Custom direction"],
        "sacrificed": ["Upstream updates", "Community contributions"]
      },
      "confidence": 95,
      "source": {
        "type": "explicit",
        "evidence": [
          {
            "type": "commit",
            "ref": "aad18745",
            "excerpt": "Initial commit: PMP-GYWD (Get Your Work Done) - forked from get-shit-done"
          }
        ]
      },
      "scope": {
        "files": [],
        "directories": ["/"],
        "global": true
      },
      "author": "cyberbloke9",
      "date": "2026-01-10",
      "tags": ["foundation", "branding", "fork"],
      "status": "active"
    },
    {
      "id": "DEC-002",
      "type": "convention",
      "summary": "Use GYWD prefix for all commands instead of GSD",
      "rationale": "Professional naming that aligns with 'Get Your Work Done' branding",
      "alternatives_considered": [
        {
          "option": "Keep /gsd: prefix",
          "reason_rejected": "Inconsistent with new branding"
        },
        {
          "option": "Use /pmp: prefix",
          "reason_rejected": "GYWD is more descriptive and memorable"
        }
      ],
      "trade_offs": {
        "gained": ["Professional appearance", "Clear branding", "Memorable commands"],
        "sacrificed": ["Familiarity for existing GSD users"]
      },
      "confidence": 92,
      "source": {
        "type": "explicit",
        "evidence": [
          {
            "type": "commit",
            "ref": "b17d2163",
            "excerpt": "feat(phase-1): standardize naming - replace all GSD references with GYWD"
          }
        ]
      },
      "scope": {
        "files": [],
        "directories": ["commands/gywd/"],
        "global": true
      },
      "author": "cyberbloke9",
      "date": "2026-01-10",
      "tags": ["naming", "convention", "branding"],
      "status": "active"
    },
    {
      "id": "DEC-003",
      "type": "architectural",
      "summary": "Zero runtime dependencies - Node.js built-ins only",
      "rationale": "Reduce installation friction, eliminate supply chain risk, maximize compatibility",
      "alternatives_considered": [
        {
          "option": "Use commander.js for CLI",
          "reason_rejected": "Adds dependency for minimal benefit"
        },
        {
          "option": "Use chalk for colors",
          "reason_rejected": "ANSI codes work natively"
        }
      ],
      "trade_offs": {
        "gained": ["Zero supply chain risk", "Fast installation", "No version conflicts"],
        "sacrificed": ["Some developer convenience", "Advanced CLI features"]
      },
      "confidence": 95,
      "source": {
        "type": "inferred",
        "evidence": [
          {
            "type": "pattern",
            "ref": "package.json",
            "excerpt": "No dependencies listed, only devDependencies: jest"
          },
          {
            "type": "pattern",
            "ref": "bin/install.js",
            "excerpt": "Uses only fs, path, os, readline - all Node.js built-ins"
          }
        ]
      },
      "scope": {
        "files": ["package.json", "bin/install.js"],
        "directories": [],
        "global": true
      },
      "author": "cyberbloke9",
      "date": "2026-01-10",
      "tags": ["dependencies", "architecture", "security"],
      "status": "active"
    },
    {
      "id": "DEC-004",
      "type": "architectural",
      "summary": "Markdown files as executable prompts, not documentation",
      "rationale": "Commands ARE prompts - Claude interprets them directly without compilation",
      "alternatives_considered": [
        {
          "option": "JSON-based command definitions",
          "reason_rejected": "Less readable, harder to maintain"
        },
        {
          "option": "TypeScript command handlers",
          "reason_rejected": "Adds build step, violates zero-dep principle"
        }
      ],
      "trade_offs": {
        "gained": ["Human readable", "No build step", "Easy to modify", "Self-documenting"],
        "sacrificed": ["Type safety", "IDE autocompletion"]
      },
      "confidence": 98,
      "source": {
        "type": "inferred",
        "evidence": [
          {
            "type": "pattern",
            "ref": "commands/gywd/",
            "excerpt": "40 .md files with YAML frontmatter and structured content"
          }
        ]
      },
      "scope": {
        "files": [],
        "directories": ["commands/gywd/"],
        "global": true
      },
      "author": "cyberbloke9",
      "date": "2026-01-10",
      "tags": ["architecture", "prompts", "design"],
      "status": "active"
    },
    {
      "id": "DEC-005",
      "type": "architectural",
      "summary": "Three-layer architecture: Commands -> Workflows -> Templates/References",
      "rationale": "Separation of concerns: WHAT (commands) vs HOW (workflows) vs FORMAT (templates)",
      "alternatives_considered": [
        {
          "option": "Monolithic command files",
          "reason_rejected": "Would lead to duplication and maintenance burden"
        }
      ],
      "trade_offs": {
        "gained": ["Reusable workflows", "Consistent output", "Maintainable codebase"],
        "sacrificed": ["More files to navigate", "Indirection complexity"]
      },
      "confidence": 90,
      "source": {
        "type": "inferred",
        "evidence": [
          {
            "type": "pattern",
            "ref": "get-your-work-done/",
            "excerpt": "Clear separation into workflows/, templates/, references/, core/"
          }
        ]
      },
      "scope": {
        "files": [],
        "directories": ["get-your-work-done/"],
        "global": true
      },
      "author": "cyberbloke9",
      "date": "2026-01-10",
      "tags": ["architecture", "organization", "patterns"],
      "status": "active"
    },
    {
      "id": "DEC-006",
      "type": "architectural",
      "summary": "File-based state management via .planning/ directory",
      "rationale": "Enable session persistence without external databases, git-trackable state",
      "alternatives_considered": [
        {
          "option": "SQLite database",
          "reason_rejected": "Adds complexity, not human-readable"
        },
        {
          "option": "Environment variables",
          "reason_rejected": "Lost between sessions"
        }
      ],
      "trade_offs": {
        "gained": ["Human readable", "Git trackable", "Session persistence", "No external deps"],
        "sacrificed": ["Query performance", "Structured relationships"]
      },
      "confidence": 95,
      "source": {
        "type": "inferred",
        "evidence": [
          {
            "type": "pattern",
            "ref": ".planning/",
            "excerpt": "PROJECT.md, ROADMAP.md, STATE.md, phases/ structure"
          }
        ]
      },
      "scope": {
        "files": [],
        "directories": [".planning/"],
        "global": true
      },
      "author": "cyberbloke9",
      "date": "2026-01-10",
      "tags": ["state", "persistence", "architecture"],
      "status": "active"
    },
    {
      "id": "DEC-007",
      "type": "convention",
      "summary": "Jest for testing with node environment",
      "rationale": "Industry standard, minimal configuration, good coverage reporting",
      "alternatives_considered": [
        {
          "option": "Mocha + Chai",
          "reason_rejected": "More setup required"
        },
        {
          "option": "No tests",
          "reason_rejected": "Quality assurance needed for installer"
        }
      ],
      "trade_offs": {
        "gained": ["Standard tooling", "Good DX", "Coverage reports"],
        "sacrificed": ["Dev dependency added"]
      },
      "confidence": 88,
      "source": {
        "type": "explicit",
        "evidence": [
          {
            "type": "commit",
            "ref": "b1fc0ab1",
            "excerpt": "feat(phase-3): add Jest test framework and initial tests"
          }
        ]
      },
      "scope": {
        "files": ["package.json", "tests/install.test.js"],
        "directories": ["tests/"],
        "global": false
      },
      "author": "cyberbloke9",
      "date": "2026-01-10",
      "tags": ["testing", "tooling", "quality"],
      "status": "active"
    },
    {
      "id": "DEC-008",
      "type": "architectural",
      "summary": "Tiered feature development (v1.1.1 -> v1.2.0 -> v1.3.0 -> v1.4.0)",
      "rationale": "Structured progression from quick wins to differentiators to paradigm shift",
      "alternatives_considered": [
        {
          "option": "Single large release",
          "reason_rejected": "Higher risk, longer feedback loop"
        }
      ],
      "trade_offs": {
        "gained": ["Incremental delivery", "Risk mitigation", "Early feedback"],
        "sacrificed": ["More release overhead"]
      },
      "confidence": 92,
      "source": {
        "type": "explicit",
        "evidence": [
          {
            "type": "commit",
            "ref": "1eb03c72",